{
  "$schema": "https://json-schema.org/draft/2020-12/schema",
  "title": "UmojaFlowOS Production Release Evidence Manifest",
  "type": "object",
  "additionalProperties": false,
  "required": ["release_sha", "environment", "created_at", "artifacts", "approvals", "worm", "reconciliation"],
  "properties": {
    "release_sha": {"type": "string", "pattern": "^[a-f0-9]{40}$"},
    "environment": {"type": "string", "enum": ["staging", "production"]},
    "created_at": {"type": "string", "format": "date-time"},
    "artifacts": {
      "type": "array",
      "minItems": 9,
      "maxItems": 9,
      "allOf": [
        {"contains": {"properties": {"evidence_id": {"const": "E-01"}}, "required": ["evidence_id"]}},
        {"contains": {"properties": {"evidence_id": {"const": "E-02"}}, "required": ["evidence_id"]}},
        {"contains": {"properties": {"evidence_id": {"const": "E-03"}}, "required": ["evidence_id"]}},
        {"contains": {"properties": {"evidence_id": {"const": "E-04"}}, "required": ["evidence_id"]}},
        {"contains": {"properties": {"evidence_id": {"const": "E-05"}}, "required": ["evidence_id"]}},
        {"contains": {"properties": {"evidence_id": {"const": "E-06"}}, "required": ["evidence_id"]}},
        {"contains": {"properties": {"evidence_id": {"const": "E-07"}}, "required": ["evidence_id"]}},
        {"contains": {"properties": {"evidence_id": {"const": "E-08"}}, "required": ["evidence_id"]}},
        {"contains": {"properties": {"evidence_id": {"const": "E-09"}}, "required": ["evidence_id"]}}
      ],
      "items": {
        "type": "object",
        "additionalProperties": false,
        "required": ["evidence_id", "path", "sha256", "run_id"],
        "properties": {
          "evidence_id": {"type": "string", "pattern": "^E-0[1-9]$"},
          "path": {"type": "string", "minLength": 1},
          "sha256": {"type": "string", "pattern": "^[a-f0-9]{64}$"},
          "run_id": {"type": "string", "minLength": 1}
        }
      }
    },
    "approvals": {
      "type": "array",
      "minItems": 4,
      "maxItems": 4,
      "allOf": [
        {"contains": {"properties": {"role": {"const": "release_manager"}}, "required": ["role"]}},
        {"contains": {"properties": {"role": {"const": "security_owner"}}, "required": ["role"]}},
        {"contains": {"properties": {"role": {"const": "compliance_owner"}}, "required": ["role"]}},
        {"contains": {"properties": {"role": {"const": "operations_owner"}}, "required": ["role"]}}
      ],
      "items": {
        "type": "object",
        "additionalProperties": false,
        "required": ["role", "subject", "release_sha", "approved_at"],
        "properties": {
          "role": {
            "type": "string",
            "enum": ["release_manager", "security_owner", "compliance_owner", "operations_owner"]
          },
          "subject": {"type": "string", "minLength": 1},
          "release_sha": {"type": "string", "pattern": "^[a-f0-9]{40}$"},
          "approved_at": {"type": "string", "format": "date-time"}
        }
      }
    },
    "worm": {
      "type": "object",
      "additionalProperties": false,
      "required": ["bucket", "object_key_prefix", "object_lock_mode", "retain_until"],
      "properties": {
        "bucket": {"type": "string", "pattern": "^[a-z0-9][a-z0-9.-]{1,61}[a-z0-9]$"},
        "object_key_prefix": {"type": "string", "minLength": 1, "pattern": "^[^/].*[^/]$"},
        "object_lock_mode": {"type": "string", "enum": ["COMPLIANCE", "GOVERNANCE"]},
        "retain_until": {"type": "string", "format": "date-time"}
      }
    },
    "reconciliation": {
      "type": "object",
      "additionalProperties": false,
      "required": ["run_id"],
      "properties": {
        "run_id": {"type": "string", "minLength": 1, "pattern": "^[A-Za-z0-9][A-Za-z0-9._:-]{7,127}$"}
      }
    }
  }
}
