{
  "release_sha": "aaaaaaaaaaaaaaaaaaaaaaaaaaaaaaaaaaaaaaaa",
  "environment": "staging",
  "created_at": "2026-08-31T23:59:00Z",
  "worm": {
    "bucket": "umoja-release-evidence",
    "object_key_prefix": "releases/example",
    "object_lock_mode": "COMPLIANCE",
    "retain_until": "2027-09-01T00:00:00Z"
  },
  "reconciliation": {
    "run_id": "staging-reconciliation-example"
  },
  "artifacts": [
    {
      "evidence_id": "E-01",
      "path": "evidence/E-01/immutable-release-provenance.json",
      "sha256": "0000000000000000000000000000000000000000000000000000000000000001",
      "run_id": "staging-e01-example-run"
    },
    {
      "evidence_id": "E-02",
      "path": "evidence/E-02/staging-migration-and-schema-validation.json",
      "sha256": "0000000000000000000000000000000000000000000000000000000000000002",
      "run_id": "staging-e02-example-run"
    },
    {
      "evidence_id": "E-03",
      "path": "evidence/E-03/postgres-integration-suite.json",
      "sha256": "0000000000000000000000000000000000000000000000000000000000000003",
      "run_id": "staging-e03-example-run"
    },
    {
      "evidence_id": "E-04",
      "path": "evidence/E-04/tigerbeetle-staging-validation.json",
      "sha256": "0000000000000000000000000000000000000000000000000000000000000004",
      "run_id": "staging-e04-example-run"
    },
    {
      "evidence_id": "E-05",
      "path": "evidence/E-05/provider-identity-aml-regulatory-integration.json",
      "sha256": "0000000000000000000000000000000000000000000000000000000000000005",
      "run_id": "staging-e05-example-run"
    },
    {
      "evidence_id": "E-06",
      "path": "evidence/E-06/deployment-rollback-health-gate.json",
      "sha256": "0000000000000000000000000000000000000000000000000000000000000006",
      "run_id": "staging-e06-example-run"
    },
    {
      "evidence_id": "E-07",
      "path": "evidence/E-07/observability-and-paging.json",
      "sha256": "0000000000000000000000000000000000000000000000000000000000000007",
      "run_id": "staging-e07-example-run"
    },
    {
      "evidence_id": "E-08",
      "path": "evidence/E-08/resilience-chaos-and-dr.json",
      "sha256": "0000000000000000000000000000000000000000000000000000000000000008",
      "run_id": "staging-e08-example-run"
    },
    {
      "evidence_id": "E-09",
      "path": "evidence/E-09/independent-security-review.json",
      "sha256": "0000000000000000000000000000000000000000000000000000000000000009",
      "run_id": "staging-e09-example-run"
    }
  ],
  "approvals": [
    {
      "role": "release_manager",
      "subject": "EXAMPLE-DISTINCT-RELEASE-MANAGER-SUBJECT",
      "release_sha": "aaaaaaaaaaaaaaaaaaaaaaaaaaaaaaaaaaaaaaaa",
      "approved_at": "2026-09-01T00:10:00Z"
    },
    {
      "role": "security_owner",
      "subject": "EXAMPLE-DISTINCT-SECURITY-OWNER-SUBJECT",
      "release_sha": "aaaaaaaaaaaaaaaaaaaaaaaaaaaaaaaaaaaaaaaa",
      "approved_at": "2026-09-01T00:20:00Z"
    },
    {
      "role": "compliance_owner",
      "subject": "EXAMPLE-DISTINCT-COMPLIANCE-OWNER-SUBJECT",
      "release_sha": "aaaaaaaaaaaaaaaaaaaaaaaaaaaaaaaaaaaaaaaa",
      "approved_at": "2026-09-01T00:30:00Z"
    },
    {
      "role": "operations_owner",
      "subject": "EXAMPLE-DISTINCT-OPERATIONS-OWNER-SUBJECT",
      "release_sha": "aaaaaaaaaaaaaaaaaaaaaaaaaaaaaaaaaaaaaaaa",
      "approved_at": "2026-09-01T00:40:00Z"
    }
  ]
}
